<?xml version="1.0" encoding="UTF-8"?>
<!DOCTYPE settings SYSTEM "../schema/env.dtd">
<settings>
	<default channel="tablet" title="sundaytimes" env="si" /> <!-- //sunday_times//sun//times-->
	<dev username="Testing" password="testpasssfsdjkfhsdklfjsdklj" />
	<si username="testuserdasdasdasd" password="testpasssdasdasdasd" />
	<stage username="testuser" password="testpass" />
	<uat username="testuser" password="testpass" />
	<prod username="testuser" password="testpass" />
	<methode path="C:\\Program Files\\EidosMedia\\Methode\\bin\\Methode.exe"/>
	<s3URL path="https://nu-cps-hub-dev-assets.s3.amazonaws.com/methode/"/>
	<s3Bucket>nu-cps-hub-dev-assets</s3Bucket>
	<s3ApiKey>APi</s3ApiKey>
	<s3ApiSecret>secret</s3ApiSecret>
	<s3MediaPath>methode/si/automation-dashboard/images/</s3MediaPath>
	<s3ReportPath>methode/si/automation-dashboard/report/</s3ReportPath>
	<articleFeed path="/articles/"/>
	<slotFeed path="/slots/"/>
	<bookFeed path="/books/"/>
	<sectionFeed path="/sections/"/>
	<editionFeed path="/editions/ljkljkljk"/>
	<imageFeed path="/assets/"/>
	<articleMetadataFeed path="/metadata/"/>
	<slotMetadataFeed path="/metadata/"/>
	<imageMetadataFeed path="/metadata/"/>
	<imagePositionalFeed path ="/positional/"/>
</settings>